{
  "id": "tpl.sell_all_inventory_credit",
  "rev": 1,
  "revKind": "text",
  "status": "published",
  "title": {
    "zh-TW": "賒銷全部存貨",
    "en": "Sell all inventory on credit"
  },
  "summary": {
    "zh-TW": "把帳上全部存貨（成本 {{money:derived.costOfAllInventory}}）以 {{money:param.price}} 賒銷給客戶，貨款之後才收。",
    "en": "Sell all inventory on the books (cost {{money:derived.costOfAllInventory}}) to a customer for {{money:param.price}} on credit, to be collected later."
  },
  "params": [
    {
      "name": "price",
      "type": "money",
      "min": 0,
      "max": 999999999999,
      "default": 2500000,
      "label": {
        "zh-TW": "售價（應收的帳款）",
        "en": "Selling price (amount receivable)"
      },
      "monotonic": "increasing"
    }
  ],
  "derived": [
    {
      "name": "costOfAllInventory",
      "type": "money",
      "expr": "balance(inventory)",
      "label": {
        "zh-TW": "全部存貨的帳上成本",
        "en": "Carrying amount of all inventory"
      }
    },
    {
      "name": "grossProfit",
      "type": "money",
      "expr": "param.price - derived.costOfAllInventory",
      "label": {
        "zh-TW": "這筆交易的毛利",
        "en": "Gross profit on this sale"
      }
    }
  ],
  "preconditions": [
    {
      "id": "has_inventory",
      "expr": "balance(inventory) > 0",
      "message": {
        "zh-TW": "帳上沒有存貨可以賣出，請先進貨。",
        "en": "There is no inventory on the books to sell. Purchase some inventory first."
      }
    }
  ],
  "lines": [
    {
      "id": "l1",
      "account": "accounts_receivable",
      "side": "debit",
      "amount": "param.price"
    },
    {
      "id": "l2",
      "account": "revenue",
      "side": "credit",
      "amount": "param.price"
    },
    {
      "id": "l3",
      "account": "cost_of_goods_sold",
      "side": "debit",
      "amount": "derived.costOfAllInventory"
    },
    {
      "id": "l4",
      "account": "inventory",
      "side": "credit",
      "amount": "derived.costOfAllInventory",
      "tag": "cost_of_sale"
    }
  ],
  "explanation": {
    "zh-TW": "賒銷和現金銷售的獲利一樣：收入在出貨時認列，成本是帳上存貨的金額。差別是收到的不是現金而是應收帳款，所以這一步獲利增加了，現金卻沒有增加；這就是「有賺錢但沒現金」的來源。",
    "en": "A credit sale earns the same profit as a cash sale: revenue is recognised when the goods are delivered and the cost is the inventory on the books. The difference is that the company receives a trade receivable rather than cash, so profit rises at this step while cash does not; this is where the gap between profit and cash comes from."
  },
  "termRefs": ["tm_r7x2c9fa", "tm_v3n8q2ye", "tm_g5c2m8tw", "tm_n7v3k8pq"]
}
