{
  "id": "tpl.pay_outsourcing_cash",
  "rev": 1,
  "revKind": "text",
  "status": "published",
  "title": {
    "zh-TW": "以現金支付外包費用",
    "en": "Pay outsourcing fees in cash"
  },
  "summary": {
    "zh-TW": "以現金 {{money:param.amount}} 支付外包的服務費用。",
    "en": "Pay {{money:param.amount}} in cash for outsourced services."
  },
  "params": [
    {
      "name": "amount",
      "type": "money",
      "min": 0,
      "max": 999999999999,
      "default": 100000,
      "label": {
        "zh-TW": "外包費用",
        "en": "Outsourcing fee"
      },
      "monotonic": "increasing"
    }
  ],
  "derived": [],
  "preconditions": [
    {
      "id": "enough_cash",
      "expr": "balance(cash) >= param.amount",
      "message": {
        "zh-TW": "帳上現金不夠付這筆款項。",
        "en": "There is not enough cash on the books for this payment."
      }
    }
  ],
  "lines": [
    {
      "id": "l1",
      "account": "outsourcing_expense",
      "side": "debit",
      "amount": "param.amount"
    },
    {
      "id": "l2",
      "account": "cash",
      "side": "credit",
      "amount": "param.amount",
      "cf": {
        "activity": "operating",
        "kind": "payments_for_operating_expenses"
      }
    }
  ],
  "explanation": {
    "zh-TW": "請外部廠商做事的費用在服務完成時就認列，屬於銷管費用；現金同時減少。它不會留下可以用很多年的資產，所以不像設備那樣資本化。",
    "en": "The cost of work done by an outside supplier is recognised when the service is delivered and belongs to distribution costs and administrative expenses; cash falls at the same time. It leaves no asset that can be used for years, so unlike equipment it is not capitalised."
  },
  "termRefs": ["tm_r3nvm8jy", "tm_c4sh8k2p"]
}
